{
  "annotation_version": "independent_eval_v1",
  "blockers": [],
  "checkpoint_sha256": "8186bbe6be424dd212d5d4a93b1ae36b80939552519706b4a8680c5d05e995f2",
  "claim_ids": [
    "IND_EVAL_V1"
  ],
  "config_id": "artps_full_frozen_mars_clf_on_amp_v1",
  "config_sha256": "29cfe32fcf95754fd7d765d49005814fdf1126c443b248db2fec9bf12950165e",
  "errors": [],
  "evaluation_purpose": "current_reproducible_evaluation",
  "evidence_mode": "real_evidence",
  "git_dirty": true,
  "git_head": "60956685129cb601b76559d38a51e2b7655f9f9d",
  "image_score_aggregation": "max_valid_candidate_after_masks",
  "manifest_sha256": "1f27e5d74bbf07b47ba8014204328f46a055c31ba4a6f31fb170cf41a910b5fe",
  "passed": true,
  "predictions_sha256": "391c36426ad26b9e38d768c24e061ac893d70288d1e1a729fd140f9f27b4a743",
  "protocol_id": "independent_eval_v1",
  "protocol_lock_sha256": "7767f695746d0237803f57ffd2fef8f96a1434fca5d2f2ffaf2c799c3187dfe9"
}
